{"harnessVersion":"1.0.0","hashNamespace":"vem-pilot-v1-sha256","laterHoldoutExclusionHash":"845e89d3710105ac72d7acdf221ac0af8273e606b608db45f2416da990164277","limitations":["ENGINEERING_SMOKE_ONLY","NO_STATISTICAL_PRODUCT_CLAIM","NO_P0_VALUE_VERDICT"],"pilotPlanVersion":"P0-T17D-UX-GATE-001-attempt-2-v1","schemaVersion":"P0-T17A-canonical-evidence-bundle-v1","setupCostBoundary":{"excludes":"per-task-location-time","includes":"fixture-and-registry-setup-only","separatelyReported":true},"taskCount":5,"taskManifestHash":"4e4946d3eb78c1b68c4673b89e6b11e0edd7100817ea594d1e19d5228a1bea2c","taskManifestVersion":"P0-T17D-task-manifest-v1","tasks":[{"armOrder":["vem-assisted","direct-search"],"fixtureCommit":"70b0c4cf53f6e8b203d6a2dabc29e3a78a0d6242","groundTruthHash":"26fa28d3cdb4800b536369325ba47c8b74a921a11945267d0b0360b669dd979c","promptHash":"69fc24993116c2f984817c35d2c60719ee1f524c17d631dd36595131e6950f71","rawRecords":[{"rawRecordHash":"cba1e09cb7ef40d4a1e07a8b4358e8871bd59d258f403d65b59efb6dd789c599","record":{"arm":"vem-assisted","armOrder":1,"chosenCandidateRank":null,"degradedTop1Match":null,"degradedTop3Match":null,"directPrimaryAvailable":true,"directPrimaryMatch":true,"directUnavailableReason":null,"fixtureCommit":"70b0c4cf53f6e8b203d6a2dabc29e3a78a0d6242","groundTruthHash":"26fa28d3cdb4800b536369325ba47c8b74a921a11945267d0b0360b669dd979c","harnessVersion":"1.0.0","hashNamespace":"vem-pilot-v1-sha256","locateDurationNs":"41167786731","locatedSourceIdentityHash":"832fbc2f552d243b8f9a3e7296b3d7bd9ae81042f7fdda6e611946d928d64b3d","operatorCorrection":false,"pilotPlanVersion":"P0-T17D-UX-GATE-001-attempt-2-v1","reselectionCount":0,"schemaVersion":"P0-T17A-raw-record-v1","selectionInputHash":"e42f733783578510d2e548151e0c4ee48d6a9d7f720b9260be0e9a8b18cbc916","selectionSnapshotHash":"f6ea9f9860ed2a90c03e646ec569a6d5bd713b80e45ab97bdbb77b7177fbf445","setupDurationNs":"34051935","sourceRegistryInputHash":"bc6c2582c50bd7abffd84943a6df210eaa09b6c10670a821dc6eb805e1b2cccd","sourceRegistryRevision":"p0-value-registry-v1","targetChanged":false,"taskId":"ux-01-manifest-row","taskManifestHash":"4e4946d3eb78c1b68c4673b89e6b11e0edd7100817ea594d1e19d5228a1bea2c","timingBoundaryHash":"4398cbf7f11a664e283be9364dd8c555b25fee223b309c233bc88208b7b2efce","trialInputHash":"f073e227218c740d9cdba406249c442e7adffd55bc95fbccddef3c4c019df688","wrongAttribution":false}},{"rawRecordHash":"8df3715c1451c15cff3eca368b976de39fd07288587ca427776b811f66bee656","record":{"arm":"direct-search","armOrder":2,"chosenCandidateRank":null,"degradedTop1Match":null,"degradedTop3Match":null,"directPrimaryAvailable":null,"directPrimaryMatch":null,"directUnavailableReason":null,"fixtureCommit":"70b0c4cf53f6e8b203d6a2dabc29e3a78a0d6242","groundTruthHash":"26fa28d3cdb4800b536369325ba47c8b74a921a11945267d0b0360b669dd979c","harnessVersion":"1.0.0","hashNamespace":"vem-pilot-v1-sha256","locateDurationNs":"41985459470","locatedSourceIdentityHash":"832fbc2f552d243b8f9a3e7296b3d7bd9ae81042f7fdda6e611946d928d64b3d","operatorCorrection":false,"pilotPlanVersion":"P0-T17D-UX-GATE-001-attempt-2-v1","reselectionCount":0,"schemaVersion":"P0-T17A-raw-record-v1","selectionInputHash":"e42f733783578510d2e548151e0c4ee48d6a9d7f720b9260be0e9a8b18cbc916","selectionSnapshotHash":"f6ea9f9860ed2a90c03e646ec569a6d5bd713b80e45ab97bdbb77b7177fbf445","setupDurationNs":"34051935","sourceRegistryInputHash":"bc6c2582c50bd7abffd84943a6df210eaa09b6c10670a821dc6eb805e1b2cccd","sourceRegistryRevision":"p0-value-registry-v1","targetChanged":false,"taskId":"ux-01-manifest-row","taskManifestHash":"4e4946d3eb78c1b68c4673b89e6b11e0edd7100817ea594d1e19d5228a1bea2c","timingBoundaryHash":"4398cbf7f11a664e283be9364dd8c555b25fee223b309c233bc88208b7b2efce","trialInputHash":"f073e227218c740d9cdba406249c442e7adffd55bc95fbccddef3c4c019df688","wrongAttribution":false}}],"selectionInputHash":"e42f733783578510d2e548151e0c4ee48d6a9d7f720b9260be0e9a8b18cbc916","selectionSnapshotHash":"f6ea9f9860ed2a90c03e646ec569a6d5bd713b80e45ab97bdbb77b7177fbf445","sourceRegistryInputHash":"bc6c2582c50bd7abffd84943a6df210eaa09b6c10670a821dc6eb805e1b2cccd","sourceRegistryRevision":"p0-value-registry-v1","taskId":"ux-01-manifest-row","trialInputHash":"f073e227218c740d9cdba406249c442e7adffd55bc95fbccddef3c4c019df688"},{"armOrder":["direct-search","vem-assisted"],"fixtureCommit":"70b0c4cf53f6e8b203d6a2dabc29e3a78a0d6242","groundTruthHash":"3f136660da49b12f14bdf108a2b82888373cd297a49468fa0540948551be9987","promptHash":"feb9cfc28decc5d5b600bcd0fa8405cf02145246661c7f9688b28c7cf6101435","rawRecords":[{"rawRecordHash":"c7df5ced11fcbf89443dabb2596d9b9165ccd226d1b348f1fa2f743425cdbd5e","record":{"arm":"direct-search","armOrder":1,"chosenCandidateRank":null,"degradedTop1Match":null,"degradedTop3Match":null,"directPrimaryAvailable":null,"directPrimaryMatch":null,"directUnavailableReason":null,"fixtureCommit":"70b0c4cf53f6e8b203d6a2dabc29e3a78a0d6242","groundTruthHash":"3f136660da49b12f14bdf108a2b82888373cd297a49468fa0540948551be9987","harnessVersion":"1.0.0","hashNamespace":"vem-pilot-v1-sha256","locateDurationNs":"55575658725","locatedSourceIdentityHash":"25f288ee68120c9c46d690fa44dbf1c206f4dd0c9dd544b93152139af46b63f0","operatorCorrection":false,"pilotPlanVersion":"P0-T17D-UX-GATE-001-attempt-2-v1","reselectionCount":0,"schemaVersion":"P0-T17A-raw-record-v1","selectionInputHash":"ab8b627a349467f51a9e1f58ad39d89222f3cde0c44d098f3b11668a16174ebf","selectionSnapshotHash":"5ada90632214c0d262474a0ed3c1aa9da5f793cf795b3058d07212777d6ff8cd","setupDurationNs":"20355967","sourceRegistryInputHash":"bc6c2582c50bd7abffd84943a6df210eaa09b6c10670a821dc6eb805e1b2cccd","sourceRegistryRevision":"p0-value-registry-v1","targetChanged":false,"taskId":"ux-02-email-input","taskManifestHash":"4e4946d3eb78c1b68c4673b89e6b11e0edd7100817ea594d1e19d5228a1bea2c","timingBoundaryHash":"4398cbf7f11a664e283be9364dd8c555b25fee223b309c233bc88208b7b2efce","trialInputHash":"85a7435ed3a7522d65cd178729697a7d53fc9a30219d6c0ee0830789f80dca48","wrongAttribution":false}},{"rawRecordHash":"76010d0449b2a64bf1c35e261b344ee08dd3ff82620286eba13adb60f5bfa01f","record":{"arm":"vem-assisted","armOrder":2,"chosenCandidateRank":null,"degradedTop1Match":null,"degradedTop3Match":null,"directPrimaryAvailable":true,"directPrimaryMatch":true,"directUnavailableReason":null,"fixtureCommit":"70b0c4cf53f6e8b203d6a2dabc29e3a78a0d6242","groundTruthHash":"3f136660da49b12f14bdf108a2b82888373cd297a49468fa0540948551be9987","harnessVersion":"1.0.0","hashNamespace":"vem-pilot-v1-sha256","locateDurationNs":"61552885672","locatedSourceIdentityHash":"25f288ee68120c9c46d690fa44dbf1c206f4dd0c9dd544b93152139af46b63f0","operatorCorrection":false,"pilotPlanVersion":"P0-T17D-UX-GATE-001-attempt-2-v1","reselectionCount":0,"schemaVersion":"P0-T17A-raw-record-v1","selectionInputHash":"ab8b627a349467f51a9e1f58ad39d89222f3cde0c44d098f3b11668a16174ebf","selectionSnapshotHash":"5ada90632214c0d262474a0ed3c1aa9da5f793cf795b3058d07212777d6ff8cd","setupDurationNs":"20355967","sourceRegistryInputHash":"bc6c2582c50bd7abffd84943a6df210eaa09b6c10670a821dc6eb805e1b2cccd","sourceRegistryRevision":"p0-value-registry-v1","targetChanged":false,"taskId":"ux-02-email-input","taskManifestHash":"4e4946d3eb78c1b68c4673b89e6b11e0edd7100817ea594d1e19d5228a1bea2c","timingBoundaryHash":"4398cbf7f11a664e283be9364dd8c555b25fee223b309c233bc88208b7b2efce","trialInputHash":"85a7435ed3a7522d65cd178729697a7d53fc9a30219d6c0ee0830789f80dca48","wrongAttribution":false}}],"selectionInputHash":"ab8b627a349467f51a9e1f58ad39d89222f3cde0c44d098f3b11668a16174ebf","selectionSnapshotHash":"5ada90632214c0d262474a0ed3c1aa9da5f793cf795b3058d07212777d6ff8cd","sourceRegistryInputHash":"bc6c2582c50bd7abffd84943a6df210eaa09b6c10670a821dc6eb805e1b2cccd","sourceRegistryRevision":"p0-value-registry-v1","taskId":"ux-02-email-input","trialInputHash":"85a7435ed3a7522d65cd178729697a7d53fc9a30219d6c0ee0830789f80dca48"},{"armOrder":["vem-assisted","direct-search"],"fixtureCommit":"70b0c4cf53f6e8b203d6a2dabc29e3a78a0d6242","groundTruthHash":"6710faf312e51d82d7d4b4a4dc64dc15e9b80a0ba080f33cd78ccd872b775d6f","promptHash":"13e621ca6ab6a6749bb4767c724bb54ae7cc5f54ab9e0af29334307dcf50033a","rawRecords":[{"rawRecordHash":"1f6f6f3fe2e9ea4c4da9f541e27a3cef64e853a84706643867f39789940c2c1a","record":{"arm":"vem-assisted","armOrder":1,"chosenCandidateRank":null,"degradedTop1Match":null,"degradedTop3Match":null,"directPrimaryAvailable":true,"directPrimaryMatch":true,"directUnavailableReason":null,"fixtureCommit":"70b0c4cf53f6e8b203d6a2dabc29e3a78a0d6242","groundTruthHash":"6710faf312e51d82d7d4b4a4dc64dc15e9b80a0ba080f33cd78ccd872b775d6f","harnessVersion":"1.0.0","hashNamespace":"vem-pilot-v1-sha256","locateDurationNs":"48724616843","locatedSourceIdentityHash":"771ea6592d624f18e88586dd458d44aa1f7050291433c01795b5c14b6036f0c6","operatorCorrection":false,"pilotPlanVersion":"P0-T17D-UX-GATE-001-attempt-2-v1","reselectionCount":0,"schemaVersion":"P0-T17A-raw-record-v1","selectionInputHash":"4a30d1620e46016f78fdc4555392ebe6904ed6b0be86fe140c6cfc53b8ac4191","selectionSnapshotHash":"5e63492cf5deface741606f6a5ec935189e68ea87f74e51caeb7c9c21890b3b4","setupDurationNs":"21713323","sourceRegistryInputHash":"bc6c2582c50bd7abffd84943a6df210eaa09b6c10670a821dc6eb805e1b2cccd","sourceRegistryRevision":"p0-value-registry-v1","targetChanged":false,"taskId":"ux-03-safe-route","taskManifestHash":"4e4946d3eb78c1b68c4673b89e6b11e0edd7100817ea594d1e19d5228a1bea2c","timingBoundaryHash":"4398cbf7f11a664e283be9364dd8c555b25fee223b309c233bc88208b7b2efce","trialInputHash":"2be0c810f41eef4ff766c58f04770053c3a5a36b5e24c103ff5664ba46b11f84","wrongAttribution":false}},{"rawRecordHash":"0d92063871034b18bf85d43d8c9fb2ad650c398da20f346236898247ef036fca","record":{"arm":"direct-search","armOrder":2,"chosenCandidateRank":null,"degradedTop1Match":null,"degradedTop3Match":null,"directPrimaryAvailable":null,"directPrimaryMatch":null,"directUnavailableReason":null,"fixtureCommit":"70b0c4cf53f6e8b203d6a2dabc29e3a78a0d6242","groun